*ID_,*TIPOQ_,*CASO_,*DATAPUB_,*DATAAGG_,*TITOLO_,*TXT_,*LINK_
5,cds,cecchettin,dic2024,dic2024,Il discorso di Mattarella: le parole del presidente della Repubblica del 31 dicembre 2024,"La Presidente del Consiglio, Giorgia Meloni, ha avuto un cordiale colloquio telefonico con il Presidente della Repubblica, Sergio Mattarella, nel corso del quale ha espresso al Capo dello Stato l'apprezzamento personale e del Governo per il messaggio di fine anno. Nel corso del colloquio, Meloni ha apprezzato il richiamo del Presidente al valore fondante del patriottismo, come motore dell'azione quotidiana e sentimento vivo che muove l'impegno di quanti sono al servizio della cosa pubblica e della comunità nazionale. Piena condivisione sulla necessità di affrontare il crescente disagio che attraversa le giovani generazioni, proponendo risposte concrete ed efficaci. Altrettanto condivisibile il richiamo ai positivi segnali macroeconomici, in particolare sull'export e sull'occupazione, con il contestuale impegno ad intensificare l'azione per ridurre le aree di precarietà e lavoro povero. Siamo chiamati a consolidare e sviluppare le ragioni poste dalla Costituzione alla base della comunità nazionale. È un’impresa che si trasmette da una generazione all’altra. Perché la speranza non può tradursi soltanto in attesa inoperosa. La speranza siamo noi. Il nostro impegno. La nostra libertà. Le nostre scelte». Nel 2025 saranno celebrati gli ottanta anni della Liberazione. «È fondamento della Repubblica e presupposto della Costituzione, che hanno consentito all’Italia di riallacciare i fili della sua storia e della sua unità», ha sottolineato il capo dello Stato, «una ricorrenza importante. Reca con sé il richiamo alla liberazione da tutto ciò che ostacola libertà, democrazia, dedizione all’Italia, dignità di ciascuno, lavoro, giustizia. Sono valori che animano la vita del nostro Paese, le attese delle persone, le nostre comunità. Si esprimono e si ricompongono attraverso l’ampia partecipazione dei cittadini al voto, che rafforza la democrazia; attraverso la positiva mediazione delle istituzioni verso il bene comune, il bene della Repubblica: è questo il compito alto che compete alla politica». La sicurezza, ha ricordato Mattarella, rimane una preoccupazione dei cittadini e massimo sostegno deve essere assicurato alle vittime dei reati. «Si affacciano però nuovi odiosi fenomeni, a partire dalle truffe agli anziani, alle aggressioni via web ai ragazzi, alla violenza di strada, crimini contro i quali le Forze dell’Ordine sono fortemente impegnate». Ma patriottismo è anche quello di chi, con origini in altri Paesi, «ama l’Italia, ne fa propri i valori costituzionali e le leggi, ne vive appieno la quotidianità, e con il suo lavoro e con la sua sensibilità ne diventa parte e contribuisce ad arricchire la nostra comunità. È fondamentale creare percorsi di integrazione e di reciproca comprensione perché anche da questo dipende il futuro delle nostre società». Un pensiero è andato all’idea di Patria. «Patriottismo», ha spiegato Mattarella, «è quello dei medici dei pronto soccorso, che svolgono il loro servizio in condizioni difficili e talvolta rischiose. Quello dei nostri insegnanti che si dedicano con passione alla formazione dei giovani. Di chi fa impresa con responsabilità sociale e attenzione alla sicurezza. Di chi lavora con professionalità e coscienza. Di chi studia e si prepara alle responsabilità che avrà presto. Di chi si impegna nel volontariato. Degli anziani che assicurano sostegno alle loro famiglie». Nel fare un bilancio di fine anno, Mattarella ha voluto ricordare il coraggio di chi ha saputo trasformare il proprio dolore, causato da un evento della vita, in una missione per gli altri. «Li ho letti nelle parole di Sammy Basso che insegnano a vivere una vita piena, oltre ogni difficoltà.Si trovano nel rumore delle ragazze e dei ragazzi che non intendono tacere di fronte allo scandalo dei femminicidi. Siamo stati drammaticamente coinvolti nell’orrore per l’inaccettabile sorte di Giulia Cecchettin e, come lei, di tante altre donne uccise dalla barbarie di uomini che non rispettano la libertà e la dignità femminile e, in realtà, non rispettano neppure sé stessi». «Abbiamo il dovere di osservare la Costituzione che indica norme imprescindibili sulla detenzione in carcere», ha detto Mattarella. «Il sovraffollamento vi contrasta e rende inaccettabili anche le condizioni di lavoro del personale penitenziario. I detenuti devono potere respirare un’aria diversa da quella che li ha condotti alla illegalità e al crimine. Su questo sono impegnati generosi operatori, che meritano di essere sostenuti». «Rispetto» è la parola su cui il presidente della Repubblica si è più soffermato. «L’Istituto della Enciclopedia italiana Treccani ha scelto, come parola dell’anno, “rispetto”», ha ricordato. E dunque: «Rispetto verso gli altri, che rappresenta il primo passo per una società più accogliente, più rassicurante, più capace di umanità. Il primo passo sulla strada per il dialogo, la collaborazione, la solidarietà, elementi su cui poggia la nostra civiltà». Poi: «Rispetto della vita, della sicurezza di chi lavora. L’ultima tragedia pochi giorni fa, a Calenzano: cinque persone sono morte. Non possono più bastare parole di sdegno: occorre agire, con responsabilità e severità. Gli incidenti mortali - tutti - si possono e si devono prevenire.Rispetto della dignità di ogni persona, dei suoi diritti. Anche per chi si trova in carcere. L’alto numero di suicidi è indice di condizioni inammissibili». Per Mattarella, fondamentale è ascoltare i giovani, vera risorsa del nostro Paese. «Possiamo contare sul loro entusiasmo, sulla loro forza creativa, sulla generosità che manifestano spesso. Abbiamo il dovere di ascoltare il loro disagio, di dare risposte concrete alle loro esigenze, alle loro aspirazioni». Un pensiero sentito il presidente della Repubblica l'ha rivolto ai giovani in pericolo. «Un’attenzione particolare richiede il fenomeno della violenza. Tocca tutto il mondo ma diviene ancor più allarmante quando coinvolge i nostri ragazzi. Bullismo, risse, uso di armi. Preoccupante diffondersi del consumo di alcool e di droghe, vecchie e nuove, anche tra i giovanissimi. Comportamenti purtroppo alimentati dal web che propone sovente modelli ispirati alla prepotenza, al successo facile, allo sballo». Ma ai dati buoni si contrappongono quelli cattivi. «Con questo aspetto confortante stride il fenomeno dei giovani che vanno a lavorare all’estero perché non trovano alternative, spesso dopo essersi laureati», sono state le parole di Mattarella, «tra Nord e Sud c’è una disuguale disponibilità di servizi. Continua il pericolo dell’abbandono delle aree interne e montane». Ottimismo per alcuni dati economici. «I dati dell’occupazione sono incoraggianti. Resistono tuttavia aree di precarietà, di salari bassi, di lavoratori in cassintegrazione. L’export italiano registra dati positivi, e così il turismo. Segno che il Paese esercita una forza di attrazione, che va anche al di là delle sue bellezze naturali, delle sue città d’arte, della sua cultura». Tuttavia, l'economia deve confrontarsi con anche con altri tipi di risultati, come quelli nella salute. «Mentre scienza, ricerca, nuove tecnologie aprono possibilità inimmaginabili fino a poco tempo addietro per la cura di malattie ritenute inguaribili, allo stesso tempo vi sono lunghe liste d’attesa per esami che, se tempestivi, possono salvare la vita. Numerose persone rinunciano alle cure e alle medicine perché prive dei mezzi necessari». Il capo dello Stato ha voluto confrontare la spesa per gli armamenti con quella per migliorare il clima nel mondo. «La crescita della spesa in armamenti, innescata nel mondo dall’aggressione della Russia all’Ucraina - che costringe anche noi a provvedere alla nostra difesa - ha toccato quest’anno la cifra record di 2.443 miliardi di dollari», ha detto, «otto volte di più di quanto stanziato alla recente Cop 29, a Baku, per contrastare il cambiamento climatico, esigenza, questa, vitale per l’umanità. Una sconfortante sproporzione». «Quelle di questa sera sono ore di speranza nel futuro, nell’anno che viene», ha proseguito Mattarella, «tocca a noi saperla tradurre in realtà. Cosa significa concretamente coltivare fiducia in un tempo segnato, oltre che dalle guerre, da squilibri, da conflitti? Vi è bisogno di riorientare la convivenza, il modo di vivere insieme. In questo periodo sembra che il mondo sia sottoposto a una allarmante forza centrifuga, capace di dividere, di allontanare, di radicalizzare le contrapposizioni». «Interpreto, in queste ore, l’angoscia di tutti per la detenzione di Cecilia Sala. Le siamo vicini in attesa di rivederla al più presto in Italia». Pace, sono le parole del capo dello Stato. Pace che non significa sottomettersi alla prepotenza di chi aggredisce gli altri Paesi con le armi, ma la pace del rispetto dei diritti umani, la pace del diritto di ogni popolo alla libertà e alla dignità. «Perché è giusto. E - se questo motivo non fosse ritenuto sufficiente - perché è l’unica garanzia di una vera pace, evitando che vengano aggrediti altri Paesi d’Europa. Questo è, quindi, il primo augurio che tutti ci rivolgiamo. Che il nuovo anno porti vera pace ovunque». Tante barbarie, ha detto Mattarella, mentre il mondo ha bisogno più che mai di pace. «Eppure mai come adesso la pace grida la sua urgenza. La pace che la nostra Costituzione indica come obiettivo irrinunziabile, che l’Italia ha sempre perseguito, anche con l’importante momento quest’anno della presidenza del G7. La pace di cui l’Unione Europea è storica espressione.La pace che non significa sottomettersi alla prepotenza di chi aggredisce gli altri Paesi con le armi, ma la pace del rispetto dei diritti umani, la pace del diritto di ogni popolo alla libertà e alla dignità». Sergio Mattarella parla in piedi, dalla Sala del Lucernaio, nella palazzina del Fuga al Quirinale, che ospita la dimora privata e lo studio dove il presidente della Repubblica riceve i suoi ospiti. Sullo sfondo si vede, in un'altra stanza, il micro mosaico della Madonna della seggiola di Raffaello, e nello studio l'albero di Natale decorato con le palline che recitano gli articoli della Costituzione, dono dell'associazione Cielo e terra. Mattarella indossa un completo blu, con cravatta in tinta. Come da tradizione, il presidente della Repubblica ha espresso subito «l'augurio più sincero» a tutti gli italiani, sottolineando che non si tratta «soltanto di un rito, è la dimostrazione della nostra natura più autentica, quella che ci chiama alla relazione con gli altri». Sergio Mattarella ha sottolineato come pure della notte di Nella e nelle festività più sentite «le barbarie non vengano risparmiate». Ricordando: «Nella notte di Natale si è diffusa la notizia che a Gaza una bambina di pochi giorni è morta assiderata. Nella stessa notte di Natale feroci bombardamenti russi hanno colpito le centrali di energia delle città dell’Ucraina per costringere quella popolazione civile al buio e al gelo. Gli innocenti rapiti da Hamas, e tuttora ostaggi, vivono un secondo inizio di anno in condizioni disumane». Come ogni 31 dicembre, c'è grande attesa per il discorso di fine anno del presidente della Repubblica seguito da moltissimi italiani e italiane. E allora dove guardarlo? Il discorso di Sergio Mattarella sarà trasmesso su molti canali televisivi tra cui Rai Uno, Rai Due, Rai Tre, Canale 5, Rete 4, La 7, SkyTG24 e Tv200 alle 20.30. Si può seguire anche sul sito del Corriere della Sera.Come sempre, si tratta di un discorso registrato nei giorni passati al palazzo del Quirinale, a Roma - sede della presidenza della Repubblica - in cui Mattarella affronterà i temi che hanno distinto questo 2024 e farà propositi per il 2o25.Qui, l'articolo completo 31 dicembre 2024, 20:12 - Aggiornata il 31 dicembre 2024, 21:46 © RIPRODUZIONE RISERVATA",https://www.corriere.it/politica/diretta-live/24_dicembre_31/discorso-mattarella-presidente-repubblica-fine-anno.shtml
6,cds,cecchettin,dic2024,dic2024,Aumentano le chiamate al 1522 e le richieste d’aiuto ai centri antiviolenza,"  Cresce il numero delle donne che si rivolge ai centri antiviolenza per cercare aiuto e uscire da situazioni di abuso. E crescono anche le chiamate al numero di emergenza 1522. La fotografia dei dati 2024 sulla violenza di genere, dimostra che a fronte dei circa 100 femminicidi del 2024 e della mancanza di una rete di protezione efficace di forze dell’ordine e istituzioni nel dopo-denuncia, aumenta la fiducia delle donne nei centri antiviolenza, considerati luoghi sicuri di accoglienza e libertà. Le strutture del circuito D.i.Re Donne in Rete contro la violenza (rete nazionale con 89 organizzazioni sul territorio, che gestisce Centri antiviolenza e Case rifugio), hanno visto aumentare, per il secondo anno consecutivo, il numero delle donne accolte, con un incremento del 14% sui dati 2023. Nei primi 10 mesi del 2024 i centri antiviolenza D.i.Re hanno accolto 21.842 donne, che secondo la proiezione sui 12 mesi, arrivano a 26.210: 3125 donne in più del 2023, una media di 2184 donne accolte ogni mese nel 2024 (nel 2023 erano 1924 al mese). Antonella Veltri, presidente di D.i.Re Donne in Rete contro la violenza, sottolinea: «Sempre più donne hanno fiducia nell’esperienza e nella competenza dei centri antiviolenza. E sempre di più decidono di uscire da situazioni di abuso rivolgendosi a uno dei nostri centri, dove sanno di trovare accoglienza non giudicante e sicura, che garantisce l’anonimato e la gratuità dell’affiancamento nel percorso di uscita». L’Osservatorio nazionale femminicidi di Non una di meno, ha analizzato 93 femminicidi nel 2024 e altri 48 tentati femminicidi. Dall’analisi emerge che la maggioranza delle donne è stata uccisa da partner o ex a coltellate, come seconda causa di femminicidio ci sono le armi da fuoco, seguono botte e violenza fisica, colpi di forbici o di martello. I dati dell’XI Rapporto Eures evidenziano che crescono le vittime over 65, nel 2024 sono state il 37,4% del totale. E aumentano le figlie uccise, generalmente all’interno di stragi familiari in cui le ragazze diventano vittime collaterali. Anche quando non vengono uccise, le ragazze si scontrano con la violenza maschile. Secondo il rapporto di Differenza Donna, il 43% delle ragazze dichiara di avere subito stalking, violenza verbale e psicologica, aggressioni fisiche e sessuali. Mariangela Zanni, presidente del Centro Veneto Progetti Donna e consigliera nazionale D.i.Re, fa notare: «Nel 2024 c’è stata più consapevolezza da parte delle donne nel cercare aiuto e c’è stata una comunicazione efficace sui numeri antiviolenza che ha portato a rivolgersi con fiducia ai centri del territorio. Anche nella rete di protezione di forze dell’ordine, istituzioni, sistema giudiziario qualcosa è cambiato. Dopo il femminicidio di Giulia Cecchettin, l’attenzione delle forze dell’ordine si è rafforzata, ma la rete istituzionale non è ancora omogenea sul territorio. Molto dipende dalla formazione sulla violenza di genere e dalla sensibilità delle forze dell’ordine e di chi lavora sistema giudiziario, differenti da regione a regione, da provincia a provincia». Due restano i nodi principali da risolvere: l’insufficienza dei finanziamenti del governo (e delle Regioni) ai centri antiviolenza e i ritardi con cui arrivano i fondi, fondamentali per riuscire a seguire e proteggere tutte le donne in difficoltà. E il numero delle case di fuga, ancora poche rispetto alla necessità. A dimostrazione della maggiore consapevolezza delle donne nel cercare sostegno per uscire dalla violenza, ci sono i dati del numero verde. Le donne che chiamano il numero 1522 sono in aumento. Il servizio, gratuito, è stato attivato nel 2006 dal Dipartimento per le pari opportunità del governo, è disponibile 7 giorni su 7 e 24 ore su 24, dal 2009 offre servizi anche alle vittime di stalking. Nei primi sei mesi del 2024 quasi 33mila le chiamate al 1522, con un aumento del 37,3% di telefonate rispetto allo stesso periodo del 2023. La provincia da cui arrivano più richieste è quella di Ferrara (Emilia Romagna), con 33,8 chiamate ogni 10mila donne con più di 14 anni. Seguono, ma a distanza, Roma (Lazio) con 13,8 chiamate e Cagliari (Sardegna) con 13,2. La provincia con meno telefonate è Enna (Sicilia) con 2,25. L’aumento di richieste riguarda soprattutto informazioni, chiarimenti sugli strumenti normativi di tutela di chi si trova in situazione di violenza e informazioni sui centri antiviolenza. Tra gli altri motivi delle chiamare, c’è lo stalking, con un forte incremento rispetto allo stesso trimestre del 2023 (+97%). Le campagne di comunicazione per diffondere il numero antiviolenza 1522 hanno funzionato: 5.459 persone l’hanno chiamato grazie alla comunicazione, ma ruolo centrale resta quello di Internet, poi c’è anche la tivù. La tipologia di violenza principale che viene raccontata all’1522 è quella fisica (43,1%), seguita da quella psicologica (35%) . Molte donne si trovano nell’inferno di più tipi di violenze, quella psicologica è di solito associata a altre forme di abuso. Le donne che chiamano denunciano atti violenti che durano da tempo, oltre la metà (52,3%) riferisce di avere subito violenza per anni. E per la maggioranza il luogo in cui la violenza avviene è la casa (72%). Dato che conferma anche l’elevata percentuale di violenza assistita: oltre la metà delle donne (58,6%) ha figli, il 54% ha figli minori che quasi sempre hanno assistito e subito violenza. Il 73% delle donne che chiama l’1522, poi, non denuncia la violenza per paura delle reazioni del partner. E il fatto che la maggioranza delle donne uccise avesse denunciato (anche più volte), non aiuta ad avere fiducia nelle forze dell’ordine e nelle istituzioni.  Di questo e di altro continueremo a parlare sulla newsletter che potete leggere direttamente dalla casella di posta, ogni martedì alle 19. Per iscrivervi cliccate qui",https://27esimaora.corriere.it/24_dicembre_31/2024-crescono-chiamate-centri-antiviolenza-4f4f2a02-c69b-11ef-9d0b-62f8dceadc46.shtml
7,cds,cecchettin,dic2024,dic2024,"La coppia che si suicida come la figlia, molestata da bambina da un parente. L'ultima intervista al papà: «Quell'uomo un assassino»","Ripubblichiamo per gentile concessione dell'Eco del Chisone di Pinerolo l'intervista integrale al padre di Chiara Giacoletto, Alessandro. L'uomo è morto il 9 dicembre, a pochi giorni di distanza dalla moglie, per le conseguenze di un tentativo di suicidio nella loro casa, non reggevano la memoria della figlia suicida dopo un abuso subito anni prima. ORBASSANO - Chiara è andata via. L’ha fatto in una gelida sera d’inverno. Con un viaggio di sola andata ha deciso, in silenzio, di non tornare indietro. Sopraffatta da un peso troppo grande, ha aspettato che i suoi genitori uscissero a cena con dei loro amici per mettere in atto quanto aveva progettato. Ha assunto degli psicofarmaci e si è tolta la vita impiccandosi ad un termosifone a parete. In casa ha lasciato cinque lettere, destinate alle persone a lei care, chiedendo loro scusa per il suo gesto. Aveva solo 28 anni, un sorriso radioso e un amore per la montagna che la portava a scalare vette e rincorrere sogni.  Chiara non c’è più. È morta il 4 febbraio di due anni fa. Domenica scorsa avrebbe compiuto 31 anni. Era figlia unica. E chi è rimasto, ancora oggi non si dà pace. Suo papà Alessandro Giacoletto è un medico stimato, molto conosciuto a Orbassano. La mamma Cristina, prima del dramma che ha sconvolto le loro esistenze, faceva la farmacista in strada Volvera. A pochi giorni dalla Giornata internazionale contro la violenza sulle donne, Giacoletto racconta la tragedia che ha distrutto la sua famiglia.E non si rassegna a considerare quello di Chiara un suicidio: «Oltre ai terribili casi che la cronaca ci espone a ritmo impressionante e che tutti conoscono e condannano – dice - esiste un mondo sommerso di situazioni esistenziali meno visibili, ma infinitamente più vasto. Mi riferisco alle donne che subiscono molestie o abusi in età infantile o adolescenziale, talora in contesti di degrado, talora all'interno di famiglie cosiddette ""normali"". L’esperienza ci insegna che, fino a quando non si subisce in modo diretto un dramma, non è possibile comprenderne sino in fondo la profondità o l’intensità». Chiara ha deciso di farla finita al termine di una giornata apparentemente ""normale"". A detta di papà Alessandro, somigliava molto - anche fisicamente – a Giulia Cecchettin, studentessa 22enne uccisa poco più di un anno fa dalle mani assassine del suo ex fidanzato. «Stesso sorriso solare, altrettanto bella e sognatrice». Amante dello studio e della letteratura, dopo una infanzia ed una adolescenza apparentemente ""normali"", il suo malessere venne fuori solo nel 2016 alla età di 23 anni, quando la ragazza stava frequentando la facoltà di Medicina. «Venne alla luce con attacchi di panico, ansia, insonnia, incubi. Chiese aiuto. Venne supportata inizialmente da una brava psicologa, poi da un ottimo psicoterapeuta con la collaborazione di uno psichiatra del servizio pubblico e poi ancora da un'altra psicoterapeuta molto brava con cui Chiara aveva un rapporto di amicizia», ricorda il genitore. La giovane aveva trovato ascolto e conforto ma non era stata in grado di rompere completamente il muro del silenzio. E dietro il suo sorriso nascondeva un dolore antico, un grido soffocato che non riusciva a emergere. Le parole non dette l’hanno divorata dentro. Per anni, i suoi genitori hanno cercato di comprendere, di aiutare, di salvarla. Ma quel dolore, radicato in un’infanzia violata, era un abisso troppo profondo. Solo nel 2018 i suoi genitori avevano scoperto l’entità del suo dramma, leggendo un diario lasciato aperto quasi per caso. Una volta confidò a suo padre quel tarlo che le divorava l’anima: «Sarebbe meglio il cancro: quello potrei toglierlo, questo no». Da allora iniziò un calvario comune a tante famiglie, alla rincorsa di una speranza di riscatto e di salvezza. Chiara era stata vittima di molestie da bambina. L’aguzzino? Una figura familiare, una persona apparentemente insospettabile, un uomo che raccontava con leggerezza le sue vicende passate, ignorando il male che portava dentro e le violenze subite che aveva riversato su una bambina indifesa. «Come emerge dalle parole di Chiara e dalle testimonianze dei professionisti che l'hanno avuta in terapia, il responsabile era un parente insospettabile, che viveva con noi a Pasta di Rivalta, morto anni fa per un tumore ai polmoni». Come troppo spesso accade, il trauma era rimasto nascosto, sepolto sotto strati di vergogna, ricatti emotivi e paura. E quando il dolore era finalmente emerso, aveva già eroso troppo. Dopo il dramma di quella tragica notte di quasi tre anni fa, la famiglia Giacoletto ha deciso di vendere la propria quota della farmacia di Orbassano e devolvere il ricavato in beneficenza, ancheper aiutare i bambini in Etiopia. Di fronte a una tragedia cosìgrande, hanno scoperto non solo l’affetto di tante persone ma anchenumerose dolorose narrazioni: «Storie mai raccontate fatte di silenzio e di dolore. Parole non dette che fanno parte di questo infinito mondo sommerso. Oggi vorrei dare voce a queste vicende. Suicidio è, in questi casi, un termine inesatto. Chi pone fine alla sua vita a causa di una violenza è vittima di un ""omicidio psichico"" e il suo aguzzino è un assassino. Ancora oggi, se il reato di abuso o molestia contro un minore è antecedente di dieci anni alla denuncia o al ricordo del fatto, questo cade in prescrizione e il responsabile non è perseguibile». Lo scorso anno i coniugi Giacoletto sono stati invitati alla sede di Emergency a Milano a sostenere una petizione europea per rendere giustizia ai sopravvissuti alle molestie subite in età infantile e adolescenziale. ""Justice Initiative"", si chiama così la raccolta firme sostenuta dalla Fondazione Guido Fluri con la partecipazione delle ""Rete l'Abuso"" fondata da Francesco Zanardi, promossa per potenziare la difesa dei minori vittime di abusi. In quell’occasione il fotografo e psicologo Simone Padovani ha presentato la sua mostra itinerante ""Shame European Stories"", una rassegna di 60 scatti in bianco e nero con i volti e i racconti di sopravvissuti: tra le immagini, anche quelle di Alessandro e Cristina, gli unici due genitori che hanno avuto il coraggio di affrontare pubblicamente un'esperienza estremamente dolorosa e dare voce a chi non c’è più. «Quando a una farfalla si toccano le ali, smette di volare», dicono. Oggi loro due si sentono delle ""ombre"" che hanno smesso di vivere quella sera di febbraio. Ma il loro desiderio è che a nessun’altra farfalla venga impedito di librarsi in cielo. E che il dolore possa trovare parole e salvare altre vite. Chiara non c’è più, ma la sua storia è un grido potente che non può passare inosservato. Paolo Polastri Vai a tutte le notizie di Torino Iscriviti alla newsletter di Corriere Torino 26 dicembre 2024 2024 ( modifica il 26 dicembre 2024 2024 | 19:03) © RIPRODUZIONE RISERVATA",https://torino.corriere.it/notizie/cronaca/24_dicembre_26/la-coppia-che-si-suicida-come-la-figlia-molestata-da-bambina-da-un-parente-l-intervista-del-padre-poche-settimane-fa-quell-uomo-57d64b2c-e425-4863-8526-a6dc35586xlk.shtml
