*ID_,*TIPOQ_,*CASO_,*DATAPUB_,*DATAAGG_,*TITOLO_,*TXT_,*LINK_
1,cds,cecchettin,gen2025,gen2025,"Giulia Cecchettin e Sammy Basso, il presidente Mattarella li ricorda a fine anno. Gino: «Ci incoraggia a guardare avanti»","Nel messaggio di fine anno agli italiani il presidente della Repubblica, Sergio Mattarella, ha ricordato due ragazzi che sono rimasti nel cuore di tutti: Sammy Basso e Giulia Cecchettin. Nel sottolineare che l’Istituto dell’Enciclopedia italiana Treccani ha scelto «rispetto» come parola dell’anno e che «i giovani sono la grande risorsa del nostro Paese», il capo dello Stato ha rivolto un pensiero a Sammy, il più longevo malato al mondo di progeria, causa dell’invecchiamento precoce. Il giovane vicentino, morto nell’ottobre scorso a 28 anni, non si è lasciato abbattere dalla malattia, si è laureato con lode in Scienze naturali all’Università di Padova, è diventato biologo, scrittore e fondatore, nel 2005, dell’Associazione italiana progeria. «La fine dell’anno è anche tempo di bilancio — ha detto Mattarella in diretta televisiva — ho incontrato valori e comportamenti positivi e incoraggianti nel volto, nei gesti, nelle testimonianze di tanti nostri concittadini. Li ho incontrati nel coraggio di chi ha saputo trasformare il suo dolore, causato da un evento della vita, in una missione per gli altri. Li ho letti nelle parole di Sammy Basso, che insegnano a vivere una vita piena, oltre ogni difficoltà. Si trovano nel rumore delle ragazze e dei ragazzi che non intendono tacere di fronte allo scandalo dei femminicidi». E qui il presidente ha ricordato Giulia Cecchettin, la studentessa ventiduenne di Vigonovo uccisa con 75 coltellate l’11 novembre 2023 a Fossò dall’ex fidanzato Filippo Turetta, coetaneo di Torreglia appena condannato all’ergastolo. «Siamo stati drammaticamente coinvolti nell’orrore per l’inaccettabile sorte di Giulia Cecchettin e, come lei, di tante altre donne uccise dalla barbarie di uomini che non rispettano la libertà e la dignità femminile e, in realtà, non rispettano neppure se stessi — ha scandito Mattarella —. Non vogliamo più dover parlare delle donne come vittime. Vogliamo e dobbiamo parlare della loro energia, del loro lavoro, del loro essere protagoniste».  «Sono stato molto felice di sentire il presidente Mattarella parlare di Giulia — confida Gino Cecchettin — non me l’aspettavo, è stata una sorpresa che mi ha riempito il cuore. È un incoraggiamento a procedere con il percorso appena intrapreso, cioè la Fondazione in memoria di Giulia. Il capo dello Stato mi aveva telefonato tre settimane dopo il delitto, all’inizio del dicembre 2023, manifestando il suo profondo cordoglio per la tragedia che la mia famiglia stava vivendo. Si è detto molto colpito da quanto era accaduto e io ho particolarmente apprezzato le sue parole, perché giunte nel momento in cui ne avevo più bisogno. Forse questo riferimento a mia figlia è anche il frutto del lavoro che stiamo facendo per sensibilizzare la collettività — aggiunge Cecchettin —. Una scelta che portiamo avanti pur nel dolore che si rinnova ogni volta in cui si torna a parlare di episodi tanto infelici. Ma lo facciamo per un fine superiore. Ringrazio il capo dello Stato, anche perché sta facendo tantissimo per tutti gli italiani, rimettendo al centro della nostra vita i valori più alti: il rispetto, l’altruismo e l’amore verso il prossimo». Il papà di Giulia non dimentica Sammy Basso: «L’ho conosciuto nel 2023 insieme ai miei figli Elena e Davide e la percezione ricevuta è stata quella di una persona eccezionale. Insegnava la vita nella sua essenza più profonda, cioè cercando la felicità, come stiamo facendo adesso noi». Felicemente sorpresa anche Laura Lucchin, mamma di Sammy, che alla Rai ha dichiarato: «Mi hanno fatto molto piacere le parole del presidente Mattarella. Sammy ci ha insegnato a guardare la vita con occhi veri». Vai a tutte le notizie di Venezia Mestre Iscriviti alla newsletter del Corriere del Veneto 2 gennaio 2025 ( modifica il 2 gennaio 2025 | 08:58) © RIPRODUZIONE RISERVATA",https://corrieredelveneto.corriere.it/notizie/cronaca/25_gennaio_02/il-presidente-mattarella-a-fine-anno-ricorda-giulia-cecchettin-e-sammy-basso-gino-ci-incoraggia-a-guardare-avanti-da837c20-6cd7-4374-822a-e1ed30017xlk.shtml
2,cds,cecchettin,dic2024,dic2024,"Mattarella ricorda Giulia Cecchettin: Stop femminicidi, rispettare dignità e libertà femminile","Agenzia VISTA / Alexander Jakhnagiev   Roma, 31 dicembre 2024
Il tradizionale discorso di fine anno del Presidente Mattarella. “La Pace mai così urgente”, la liberazione di Cecilia Sala, i miliardi spesi per nuovi armamenti e i pochissimi fondi destinati alla tutela dell’ambiente. L'urgenza della pace in Ucraina e in Medio Oriente, le liste infinite della sanità pubblica, il ruolo dei giovani. Alcuni dei temi di cui ha parlato il Presidente Mattarella.  ",https://video.corriere.it/politica/voci-dal-parlamento/mattarella-ricorda-giulia-cecchettin-stop-femminicidi-rispettare-dignita-liberta-femminile/7e7e950c-c7c1-11ef-be57-92748a49bbf9
3,cds,cecchettin,dic2024,dic2024,Il testo integrale del discorso di fine anno di Mattarella,"Care concittadine e cari concittadini,questo nostro incontro tradizionale mi consente di rivolgere l’augurio più sincero a tutti voi, a chi si trova in Italia e agli italiani che sono all’estero.Stiamo vivendo come ogni fine anno ore di attesa per un tempo nuovo che viene e che speriamo migliore.Ore in cui cerchiamo la serenità rinsaldando i nostri rapporti. Nelle nostre comunità, nelle famiglie, nelle amicizie. Facciamo i nostri auguri e ne riceviamo. Non è soltanto un rito, è la dimostrazione della nostra natura più autentica, quella che ci chiama alla relazione con gli altri.Lo facciamo, dobbiamo farlo tanto più in quanto viviamo momenti difficili. Quando migliaia di vittime civili delle guerre in corso turbano tragicamente le nostre coscienze. Nella notte di Natale si è diffusa la notizia che a Gaza una bambina di pochi giorni è morta assiderata. Nella stessa notte di Natale feroci bombardamenti russi hanno colpito le centrali di energia delle città dell’Ucraina per costringere quella popolazione civile al buio e al gelo.Gli innocenti rapiti da Hamas, e tuttora ostaggi, vivono un secondo inizio di anno in condizioni disumane. Queste forme di barbarie non risparmiano neppure il Natale e le festività più sentite.Eppure mai come adesso la pace grida la sua urgenza.  La pace che la nostra Costituzione indica come obiettivo irrinunziabile, che l’Italia ha sempre perseguito, anche con l’importante momento quest’anno della presidenza del G7. La pace di cui l’Unione Europea è storica espressione. La pace che non significa sottomettersi alla prepotenza di chi aggredisce gli altri Paesi con le armi, ma la pace del rispetto dei diritti umani, la pace del diritto di ogni popolo alla libertà e alla dignità.Perché è giusto. E - se questo motivo non fosse ritenuto sufficiente - perché è l’unica garanzia di una vera pace, evitando che vengano aggrediti altri Paesi d’Europa.Questo è, quindi, il primo augurio che tutti ci rivolgiamo. Che il nuovo anno porti vera pace ovunque. Interpreto, in queste ore, l’angoscia di tutti per la detenzione di Cecilia Sala. Le siamo vicini in attesa di rivederla al più presto in Italia.Quanto avviene segnala ancora una volta il valore della libera informazione. Tanti giornalisti rischiano la vita per documentare quel che accade nelle sciagurate guerre ai confini dell’Europa, in Medio Oriente e altrove. Spesso pagano a caro prezzo il servizio che rendono alla comunità. La notte di Natale Papa Francesco - cui invio auguri pieni di riconoscenza - ha aperto il Giubileo, facendo risuonare nel mondo il richiamo alla speranza. Quelle di questa sera sono ore di speranza nel futuro, nell’anno che viene. Tocca a noi saperla tradurre in realtà. Cosa significa concretamente coltivare fiducia in un tempo segnato, oltre che dalle guerre, da squilibri, da conflitti? Vi è bisogno di riorientare la convivenza, il modo di vivere insieme. In questo periodo sembra che il mondo sia sottoposto a una allarmante forza centrifuga, capace di dividere, di allontanare, di radicalizzare le contrapposizioni.Sono lacerate le pubbliche opinioni. Faglie profonde attraversano le nostre società. La realtà che viviamo ci presenta contraddizioni che generano smarrimento, sgomento, talvolta senso di impotenza. A livello globale aumenta in modo esponenziale la ricchezza di pochissimi mentre si espande la povertà di tanti.La crescita della spesa in armamenti, innescata nel mondo dall’aggressione della Russia all’Ucraina - che costringe anche noi a provvedere alla nostra difesa - ha toccato quest’anno la cifra record di 2.443 miliardi di dollari. Otto volte di più di quanto stanziato alla recente Cop 29, a Baku, per contrastare il cambiamento climatico, esigenza, questa, vitale per l’umanità. Una sconfortante sproporzione. Luci e ombre riguardano anche la nostra Italia. La scienza, la ricerca, le nuove tecnologie aprono possibilità inimmaginabili fino a poco tempo addietro per la cura di malattie ritenute inguaribili. Nello stesso tempo vi sono lunghe liste d’attesa per esami che, se tempestivi, possono salvare la vita. Numerose persone rinunciano alle cure e alle medicine perché prive dei mezzi necessari. I dati dell’occupazione sono incoraggianti. Resistono tuttavia aree di precarietà, di salari bassi, di lavoratori in cassintegrazione.L’export italiano registra dati positivi, e così il turismo. Segno che il Paese esercita una forza di attrazione, che va anche al di là delle sue bellezze naturali, delle sue città d’arte, della sua cultura.Con questo aspetto confortante stride il fenomeno dei giovani che vanno a lavorare all’estero perché non trovano alternative, spesso dopo essersi laureati. Tra Nord e Sud c’è una disuguale disponibilità di servizi. Continua il pericolo dell’abbandono delle aree interne e montane.Colmare queste distanze. Assicurare una effettiva pienezza di diritti è il nostro compito. Il mutamento del clima incide decisamente anche sugli eventi meteo che subiamo in Italia: ne abbiamo ripetute testimonianze. Le alluvioni non possono più essere considerate fatti straordinari. Sono frequenti e vanno quindi prevenute con lungimiranza, rimuovendo le condizioni che provocano sciagure.Un’attenzione particolare richiede il fenomeno della violenza. Tocca tutto il mondo ma diviene ancor più allarmante quando coinvolge i nostri ragazzi.Bullismo, risse, uso di armi. Preoccupante diffondersi del consumo di alcool e di droghe, vecchie e nuove, anche tra i giovanissimi. Comportamenti purtroppo alimentati dal web che propone sovente modelli ispirati alla prepotenza, al successo facile, allo sballo. I giovani sono la grande risorsa del nostro Paese. Possiamo contare sul loro entusiasmo, sulla loro forza creativa, sulla generosità che manifestano spesso. Abbiamo il dovere di ascoltare il loro disagio, di dare risposte concrete alle loro esigenze, alle loro aspirazioni.La precarietà e l’incertezza che avvertono le giovani generazioni vanno affrontate con grande impegno anche perché vi risiede una causa rilevante della crisi delle nascite che stiamo vivendo. Si intrecciano, quindi, straordinarie potenzialità e punti di debolezza da risolvere. Impegniamoci per una comune speranza che ci conduca con fiducia verso il futuro. L’Istituto della Enciclopedia Italiana Treccani ha scelto, come parola dell’anno, «rispetto».Il rispetto verso gli altri rappresenta il primo passo per una società più accogliente, più rassicurante, più capace di umanità. Il primo passo sulla strada per il dialogo, la collaborazione, la solidarietà, elementi su cui poggia la nostra civiltà.Rispetto della vita, della sicurezza di chi lavora. L’ultima tragedia pochi giorni fa, a Calenzano: cinque persone sono morte. Non possono più bastare parole di sdegno: occorre agire, con responsabilità e severità. Gli incidenti mortali - tutti - si possono e si devono prevenire. Rispetto della dignità di ogni persona, dei suoi diritti. Anche per chi si trova in carcere. L’alto numero di suicidi è indice di condizioni inammissibili. Abbiamo il dovere di osservare la Costituzione che indica norme imprescindibili sulla detenzione in carcere. Il sovraffollamento vi contrasta e rende inaccettabili anche le condizioni di lavoro del personale penitenziario. I detenuti devono potere respirare un’aria diversa da quella che li ha condotti alla illegalità e al crimine. Su questo sono impegnati generosi operatori, che meritano di essere sostenuti. La fine dell’anno è anche tempo di bilancio. Ho incontrato valori e comportamenti positivi e incoraggianti nel volto, nei gesti, nelle testimonianze di tanti nostri concittadini. Li ho incontrati nel coraggio di chi ha saputo trasformare il suo dolore, causato da un evento della vita, in una missione per gli altri. Li ho letti nelle parole di Sammy Basso che insegnano a vivere una vita piena, oltre ogni difficoltà. Si trovano nel rumore delle ragazze e dei ragazzi che non intendono tacere di fronte allo scandalo dei femminicidi.Siamo stati drammaticamente coinvolti nell’orrore per l’inaccettabile sorte di Giulia Cecchettin e, come lei, di tante altre donne uccise dalla barbarie di uomini che non rispettano la libertà e la dignità femminile e, in realtà, non rispettano neppure sé stessi. Non vogliamo più dover parlare delle donne come vittime. Vogliamo e dobbiamo parlare della loro energia, del loro lavoro, del loro essere protagoniste. Ho fatto riferimento ad alcuni esempi di persone che hanno scelto di operare per il bene comune perché è proprio questa trama di sentimenti, di valori, di tensione ideale quel che tiene assieme le nostre comunità e traduce in realtà quella speranza collettiva che insieme vogliamo costruire.È questa medesima trama che ci consentirà di evitare quelle divaricazioni che lacerano le nostre società producendo un deserto di relazioni, un mondo abitato da tante solitudini. Siamo tutti chiamati ad agire, rifuggendo da egoismo, rassegnazione o indifferenza. Nella quotidiana esperienza di tanti nostri concittadini si manifesta un sentimento vivo, sempre attuale, dell’idea di Patria.Mi ha colpito, di recente, l’entusiasmo degli allievi della nostra Marina militare, su nave Trieste, all’avvio del loro servizio per l’Italia e per i suoi valori costituzionali. Come stanno facendo in questo momento tanti nostri militari in diversi teatri operativi. Ad essi rinnovo la riconoscenza della Repubblica. Patriottismo è quello dei medici dei pronto soccorso, che svolgono il loro servizio in condizioni difficili e talvolta rischiose. Quello dei nostri insegnanti che si dedicano con passione alla formazione dei giovani. Di chi fa impresa con responsabilità sociale e attenzione alla sicurezza. Di chi lavora con professionalità e coscienza. Di chi studia e si prepara alle responsabilità che avrà presto. Di chi si impegna nel volontariato. Degli anziani che assicurano sostegno alle loro famiglie.È patriottismo quello di chi, con origini in altri Paesi, ama l’Italia, ne fa propri i valori costituzionali e le leggi, ne vive appieno la quotidianità, e con il suo lavoro e con la sua sensibilità ne diventa parte e contribuisce adarricchire la nostra comunità. È fondamentale creare percorsi di integrazione e di reciproca comprensione perché anche da questo dipende il futuro delle nostre società. La sicurezza rimane una preoccupazione dei cittadini e massimo sostegno deve essere assicurato alle vittime dei reati.Dal Rapporto Censis, sulla base di dati del Ministero dell’Interno, risulta che, dal 2013 al 2024, sono stati raggiunti risultati significativi sul fronte della prevenzione, con una forte riduzione degli omicidi volontari, delle rapine, dei furti nelle abitazioni.Siamo grati alle Forze dell’Ordine, presidio della libertà dei cittadini, per il contributo decisivo che recano alla cornice di sicurezza in cui vive il nostro Paese. Si affacciano nuovi odiosi fenomeni, a partire dalle truffe agli anziani, alle aggressioni via web ai ragazzi, alla violenza di strada, crimini contro i quali le Forze dell’Ordine sono fortemente impegnate. Desidero rivolgere un saluto alle donne e agli uomini di sport in questo che è stato un anno olimpico e paralimpico. Ricordo le notti di Parigi, l’orgoglio dei nostri atleti attorno alla nostra bandiera. Sono a loro grato per i successi e ancor di più per l’autentico spirito sportivo con cui hanno vissuto la loro partecipazione: un bell’esempio, ben oltre i confini dello sport. Nel 2025 celebreremo gli ottanta anni della Liberazione.È fondamento della Repubblica e presupposto della Costituzione, che hanno consentito all’Italia di riallacciare i fili della sua storia e della sua unità.Una ricorrenza importante. Reca con sé il richiamo alla liberazione da tutto ciò che ostacola libertà, democrazia, dedizione all’Italia, dignità di ciascuno, lavoro, giustizia. Sono valori che animano la vita del nostro Paese, le attese delle persone, le nostre comunità. Si esprimono e si ricompongono attraverso l’ampia partecipazione dei cittadini al voto, che rafforza la democrazia; attraverso la positiva mediazione delle istituzioni verso il bene comune, il bene della Repubblica: è questo il compito alto che compete alla politica. Siamo chiamati a consolidare e sviluppare le ragioni poste dalla Costituzione alla base della comunità nazionale. È un’impresa che si trasmette da una generazione all’altra.Perché la speranza non può tradursi soltanto in attesa inoperosa.La speranza siamo noi. Il nostro impegno. La nostra libertà. Le nostre scelte. Buon anno a tutti!  Se vuoi restare aggiornato sulle notizie di politica iscriviti alla newsletter ""Diario Politico"". E' dedicata agli abbonati al Corriere della Sera e arriva due volte alla settimana alle 12. Basta cliccare qui. 31 dicembre 2024 © RIPRODUZIONE RISERVATA",https://www.corriere.it/politica/24_dicembre_31/il-testo-integrale-del-discorso-di-fine-anno-di-mattarella-6424eda0-e15c-4628-880a-c86a8d94fxlk.shtml
4,cds,cecchettin,dic2024,dic2024,"«Italia», «Pace» e «Comunità»: le parole utilizzate dal capo dello Stato Mattarella nel suo messaggio di fine anno","Il messaggio di fine anno per il 2024 del presidente Sergio Mattarella, rivolto alle «concittadine» e ai «concittadini», consta di 1912 parole. Si tratta di un testo dunque mediamente più lungo rispetto alla tradizione, anche se già il discorso di fine 2023 aveva raggiunto le 1864 parole.«Italia», ripetuto 9 volte, è la parola più presente nel discorso del Presidente, seguita da «Pace», una ricorsività – l’anno scorso era questa la parola più citata, ben 11 volte – che contraddistingue il periodo di guerra che il mondo sta tuttora vivendo. Un periodo di violenze che di fatto è stato il tema con cui Mattarella ha aperto, citando il conflitto in Medio Oriente e quello in Ucraina. La parola «Guerra», che con «Violenza» si presentava come la parola con più ricorrenze (rispettivamente 8 e 9) dopo appunto «Pace» lo scorso anno, ha però una presenza fortemente ridotta. Le parole scelte dal Quirinale per il messaggio di quest’anno sembrano più orientate verso i valori positivi: accompagnano l’augurio del Presidente che «il nuovo anno porti vera pace ovunque». «Comunità», «Vita» e «Speranza» sono dunque sul terzo gradino del podio delle parole maggiormente ripetute da Mattarella, subito seguite da «Rispetto», «Libertà» e «Valori» con 5 occorrenze ognuna. Abbiamo individuato anche un trittico finale, parole che vengono ripetute 4 volte ognuna, che insieme alle altre citate vanno a costruire un messaggio proiettato al futuro: «Costituzione», «Giovani» e «Dignità».Infine, sono stati tre gli italiani citati nominalmente da Mattarella nel suo messaggio. Si tratta di Cecilia Sala, la giornalista arrestata a Teheran, Sammy Basso, il 28enne malato di progeria scomparso lo scorso ottobre, Giulia Cecchettin, la ragazza uccisa dal fidanzato lo scorso anno.  31 dicembre 2024 © RIPRODUZIONE RISERVATA",https://www.corriere.it/tecnologia/24_dicembre_31/italia-pace-e-comunita-le-parole-utilizzate-dal-capo-dello-stato-mattarella-nel-suo-messaggio-di-fine-anno-f83fa184-a4d1-43d6-a049-a125212e4xlk.shtml
