*ID_,*TIPOQ_,*CASO_,*DATAPUB_,*DATAAGG_,*TITOLO_,*TXT_,*LINK_
13,cds,cecchettin,dic2024,dic2024,"Don Mazzi: «L'ergastolo a Turetta? Ecco come la penso. In carcere seguo un giovane che ha ucciso il padre all'improvviso, era il migliore della classe»","«L’ergastolo non è la risposta giusta anche per chi commette il più orribile dei reati». Il fondatore della Comunità Exodus, il veronese don Antonio Mazzi, 95 anni, volto noto della tivù, mantiene una parlantina veloce nonostante l’età e non perde la voglia di confrontarsi con le realtà più dure. Affronta da sempre i casi di cronaca più clamorosi e delicati e talvolta segue personalmente anche gli autori di questi terribili gesti. Ha letto molti articoli sull’omicidio di Giulia Cecchettin, non conosce personalmente i famigliari della vittima, il ventiduenne Filippo Turetta e i suoi parenti ma ha un’opinione chiara su questa vicenda.  «Il papà di Giulia, Gino Cecchettin, è una persona matura e intelligente e dovrebbe riuscire a capire che quando una persona viene condannata all’ergastolo, poi la si identifica con lo sbaglio. In pratica, Turetta è diventato uno sbaglio. Se, invece, non lo condanni al fine pena mai, ha fatto un errore per quanto enorme possa essere». La sentenza della Corte d’assise di Venezia è ormai agli atti«La gente pensa che uno come Filippo Turetta meriti il carcere a vita e deve crepare tra le sbarre perché lui è lo sbaglio.  Secondo me, però, Cecchettin ha dentro di sé la voglia di affrontare in modo diverso la tragica perdita di sua figlia». Sente il bisogno di perdonare?«Non è il perdono secondo me, ma è collocare lo sbaglio nel posto giusto». E lui cosa può fare?«Una persona come Cecchettin può riuscire a far capire che è vero che Turetta ha una colpa terribile, ma lui non è solo un tragico errore». Nel Paese il sentimento comune però è diverso.«Dico questo: sono quarant’anni che affronto queste problematiche e trovare un papà come Gino Cecchettin è utile per tentare di uscire da questi labirinti ideologici» Vorrebbe incontrarlo?«Se avesse voglia, lo vedrei molto volentieri ma non voglio obbligarlo, è solo una mia speranza». E Filippo Turetta? «Non l’ho mai conosciuto personalmente anche perché lui si trova nel carcere di Verona e io seguo solo i detenuti qui a  Milano. Non vale la pena andare nei penitenziari una volta ogni tanto. Non serve ai detenuti. Per aiutarli, bisogna creare delle relazioni piano piano». Ai genitori di Turetta vorrebbe comunicare qualcosa?«Ho già detto quello che pensavo sul caso del loro figlio. Al di là della decisione di parlare con i genitori, questo omicidio è diventato così importante che può in qualche modo creare sviluppi interessanti». Quali?«Per esempio, si può iniziare a vedere il carcere in modo diverso anche per chi commette reati gravissimi. E, soprattutto, si può ripensare alla pena dell’ergastolo». Come si possono prevenire i casi come quelli di Giulia?«Si fa fatica a capire come possano succedere questi omicidi. Io sto seguendo un giovane che ha ucciso suo padre, improvvisamente, mentre erano a tavola a cena, ha preso un coltello, l’ha colpito alla pancia e gli ha tolto la vita. È sempre stato il migliore della classe, un ragazzo eccezionale fino al giorno dell’omicidio». Ed è riuscito a darsi una spiegazione?«Bisogna avere il coraggio di ammettere  che certe tragedie non si capiscono. Dobbiamo essere umili». Ha appena compiuto 95 anni, età non banale«Il Padreterno non ha ancora tirato su il telefono, capisce?  Qualche ora fa, è morto uno dei miei carissimi amici che lavorava con noi qui a Exodus e aveva solo qualche anno meno di me. Per lui il Signore ha alzato il telefono». Vai a tutte le notizie di Verona Iscriviti alla newsletter del Corriere del Veneto 12 dicembre 2024 2024 ( modifica il 12 dicembre 2024 2024 | 11:42) © RIPRODUZIONE RISERVATA",https://corrieredelveneto.corriere.it/notizie/verona/cronaca/24_dicembre_12/don-mazzi-anche-per-filippo-turetta-l-ergastolo-non-e-la-risposta-giusta-in-carcere-seguo-un-giovane-che-ha-ucciso-il-padre-all-e0fcd706-6369-44a3-a5d6-8c771630fxlk.shtml
14,cds,cecchettin,dic2024,dic2024,"Belluno, corteggiatore fa ricorso contro l'ammonimento del questore. Il Tar gli dà ragione: «Insistente ma non tale da causare ansia o paura all'altra parte»","Si era invaghito della cameriera e andava nel bar ogni volta che poteva per corteggiarla. In maniera assidua, a lei non gradita. Per toglierselo di torno, si era rivolta alla polizia e così la questura di Belluno (il fatto accade nel Bellunese)  aveva emesso nei confronti dell’uomo un provvedimento di ammonimento. Lui, confermando la propria tenacia, ha fatto ricorso al Tar. Che gli ha dato ragione ed ha annullato il provvedimento. Con una sentenza che è esemplare dal punto di vista della simmetria: il nome di lui è oscurato, invece l’identità della donna è in piena visibilità con tanto di nome e cognome.  Fa discutere la sentenza della Seconda Sezione del Tar del Veneto che ha accolto la richiesta dell’insistente corteggiatore di azzerare il provvedimento. La motivazione: «I gesti compiuti dal ricorrente all’interno dei bar nel tentativo di conquistare la A. (ndr: nome puntato dopo averne squadernato le generalità in apertura di provvedimento) pur avendo potuto creare imbarazzo o fastidio nella controinteressata, valutati nello specifico contesto sono da considerare innocui e inoffensivi». Si citano come atti del corteggiamento la consegna di rose per il compleanno e la messa a disposizione di un buono di 500 euro da spendere in gioielleria. I giudici evidenziano: «Gli unici contatti privati tra il ricorrente e la controinteressata sono avvenuti “a distanza”, attraverso messaggi telefonici o telematici con i quali, spesso in concomitanza con festività o ricorrenze (es. San Valentino, 8 marzo), lo Z. manifestava alla A. Non consta che lo Z. abbia inviato alla A. messaggi volgari o a sfondo sessuale. Neppure risulta che il ricorrente abbia mai aspettato la ricorrente all’ingresso e/o all’uscita del luogo di lavoro né tampoco sotto casa o in altri luoghi né che egli sia mai avvicinato al figlio della A. e/o al di lei compagno. Non vi sono, insomma, elementi obiettivi per ritenere che il corteggiamento (fenomeno naturale ed ineliminabile nella vita di relazione), pur insistente, del ricorrente abbia ingenerato un perdurante e grave stato di ansia e di paura nella controinteressata». Il Tar conclude che era un corteggiamento senza tratti presecutori, non una ossessione pericolosa. Stalking, per dirla con termine mutuato dalla giurisprudenza anglosassone che nel nostro Paese non solo non viene pronunciato bene ma è concetto scivoloso per l’ordinamento. Ha fatto molto discutere che l’aggravante per comportamenti persecutori non sia stata riconosciuta nella condanna all’ergastolo per Filippo Turetta perché la giovane donna che lui ha ucciso, Giulia Cecchettin, era andata all’ultimo appuntamento e non aveva manifestato segni di «perdurante e grave stato di ansia». A lei Pippo faceva paura e pena al tempo stesso, come dimostra la letteratura dei messaggi. Terreno scivolossissimo. «A quanto risulta dagli atti, A., pur dopo qualche titubanza, ha accettato di buon grado un regalo del ricorrente (buono di € 200,00 da spendere in un negozio di abbigliamento), lo ha reso partecipe delle proprie disavventure imprenditoriali e delle proprie difficoltà economiche (circostanza che denota come tra i due si fosse creata una certa confidenza) e, comunque, quando ha voluto, ha sempre dimostrato di sapersi “smarcare” agevolmente dalle avance dello Z., respingendo i suoi inviti a cena, facendogli servire le consumazioni da una collega, bloccando il suo numero di cellulare et similia», scrivono i giudici del Tar, accogliendo la richiesta di Z.: «Ritenuto che i comportamenti posti in essere dal ricorrente, pur avendo infastidito la A., non abbiano assunto una gravità tale da poter essere qualificati alla stregua di veri e propri atti persecutori - il ricorso deve essere accolto, con conseguente annullamento del provvedimento impugnato». La complessa relazione tra stalker e vittima è stato un successo su Netflix qualche mese fa con la ministerie «Baby Reindeer». Ovviamente, la presunta stalker ha fatto causa al network. Vai a tutte le notizie di Venezia Mestre Iscriviti alla newsletter del Corriere del Veneto 10 dicembre 2024 2024 ( modifica il 11 dicembre 2024 2024 | 09:29) © RIPRODUZIONE RISERVATA",https://corrieredelveneto.corriere.it/notizie/venezia-mestre/cronaca/24_dicembre_10/belluno-corteggiatore-fa-ricorso-contro-l-ammonimento-del-prefetto-il-tar-gli-da-ragione-insistente-ma-non-tale-da-causare-ansia-a8255106-7824-4485-9c80-214f73410xlk.shtml
15,cds,cecchettin,dic2024,dic2024,Una scultura di sabbia per ricordare Giulia Cecchettin: l'opera dell'artista Nicola Urru,"CorriereTv  Una scultura di sabbia per ricordare Giulia Cecchettin. L'artista Nicola Urru ha realizzato la sua opera sulla spiaggia di Platamona, in provincia di Sassari, a pochi giorni dalla condanna all'ergastolo di Filippo Turetta. La scultura occupa una superficie di circa 20 metri e rappresenta una foto di Giulia e sua mamma Monica abbracciate e con delle ali angeliche. Uno scatto che qualche tempo fa Gino Cecchettin aveva pubblicato su Instagram con la didascalia: «I miei amori». ",https://video.corriere.it/cronaca/una-scultura-di-sabbia-per-ricordare-giulia-cecchettin-l-opera-dell-artista-nicola-urru/2830ef99-6ede-41d0-bbd5-c85c95639xlk
16,cds,cecchettin,dic2024,dic2024,La forma della crudeltà nell'omicidio di Giulia,"In cosa consiste l’esemplarità di una condanna? Nella piena corrispondenza della pena erogata al reato commesso, comminata senza sconti? La giusta condanna, adeguata alla fattispecie prevista dalla legge, è esemplare, in questo senso? Costituisce cioè un precedente giurisprudenziale da prendere a esempio di correttezza processuale o invece, per assurgere al rango dell’esemplarità, ha bisogno di qualcosa di più, cioè di un aggravio di pena (un «resto», come lo chiamavano i genitori di una volta quando avevano finito di picchiarti, e se continuavi a frignare ti rifilavano la volgarissima, insopportabile frase di rito: «E ora piantala se no hai pure il resto») che faccia da esempio, cioè da intimidazione per dissuadere dalla commissione di altri reati dello stesso tipo? È dal significato che si attribuisce al concetto di esempio (o meglio, dallo scopo a cui si sceglie di rivolgerlo) che derivano la giustezza o la diseducatività della condanna (perché una condanna che strapunisce non educa e non fa giustizia).  È togliendolo dall’ambivalenza (una caratteristica tipica della lingua italiana) che si fa luce. Perché l’esempio può essere un modello (possibilmente positivo) da seguire, o una minaccia. E siccome allo Stato di diritto non interessa l’intimidazione ma la giustizia (quando riesce a realizzarla), si guarda dal condannare esemplarmente. È la condanna giusta, quella che non oltrepassa i limiti della legge e non conferisce a chi la commina la discrezionalità di applicarla a dismisura, l’unica che una società civile può permettersi. Se così è, alla lettura della sentenza del tribunale di Venezia che ha emesso una condanna all’ergastolo per l’omicidio di Giulia Cecchettin, viene da domandarsi se l’aver escluso le aggravanti della crudeltà e dello stalking non tolgano alla sentenza stessa il valore dell’esemplarità intesa nella sua versione corretta, cioè non come messaggio intimidatorio da mandare alla collettività ma come giusto prezzo di un delitto commesso. Perché non è stata esclusa la premeditazione (né sono state concesse attenuanti); e la premeditazione è (o può essere considerata) una forma di crudeltà, una sua declinazione. Come faccio a progettare un omicidio se non sono mosso da un sentimento crudele? E poi: si può escludere un comportamento persecutorio invocando una frequentazione, sia pure non continuativa, fra vittima e stalker, o la mancanza di paura della persona perseguitata? Sarebbe fin troppo semplice ridurre al terrore lo stato d’inferiorità e di esposizione al pericolo in cui versa una donna vittimizzata da un persecutore. Lo stalking è un reato molto più subdolo e complesso. E fa un’infinita tristezza dover constatare, sia pure a fronte a una giusta condanna all’ergastolo, la mancanza di un elemento così importante.A sabato prossimo. Vai a tutte le notizie di Napoli Iscriviti alla newsletter del Corriere del Mezzogiorno Campania 7 dicembre 2024 2024 © RIPRODUZIONE RISERVATA",https://napoli.corriere.it/notizie/cultura-e-tempo-libero/24_dicembre_07/la-forma-della-crudelta-nell-omicidio-di-giulia-87748ce0-6cb3-4c1a-8833-602bc8612xlk.shtml
17,cds,cecchettin,dic2024,dic2024,Il coraggio di un uomo e l'eredità di Giulia,"Si chiama Alen, ha 21 anni e fa il camionista. Il 2 dicembre, a Guastalla, ha sentito le urla di una donna e non ha tirato dritto. È sceso dal camion, ha visto che un uomo la stava aggredendo ed è intervenuto, salvandola. Ha fatto ciò che andava fatto. La cosa più logica. L’unica possibile. Eppure, niente affatto scontata. Dopo, a chi gli ha dato dell’eroe, ha detto: «Quando parlavo di Giulia Cecchettin, mi dicevo sempre che se fossi stato lì, avrei fatto di tutto per salvarla». Se non ci fosse stata la morte di Giulia, avrebbe fatto la stessa cosa? Forse. Alen è certamente un ragazzo coraggioso. Ma è a Giulia che ha pensato sentendo quelle grida. È Giulia che, in qualche modo, lo ha spinto ad agire. Può andare fiero di tutto ciò Gino Cecchettin, perché è a lui che dobbiamo questo nuovo impulso. Questa attenzione che, ogni giorno, si alimenta del suo impegno. Questa consapevolezza che — ed è la vera novità — riguarda, sempre più, anche gli uomini. Sebbene ancora troppo pochi. Basta dare un’occhiata ai social. «Ma cosa vuole questo signore?», chiedeva un utente di Threads infastidito dalle parole posate di Gino dopo l’ergastolo a Turetta. Semplice: che non ci siano più femminicidi. E che ci siano più Alen. Dove Alen non significa solo uomini disposti a rischiare la vita per salvare una donna (o un essere umano qualsiasi). Ma anche: uomini che non accettano la violenza, sia essa fisica, verbale, psicologica, economica. Esplicita o subdola. Che la combattono con coraggio, mettendoci la faccia. Gino è un esempio. Alen è un esempio: «Non sono un eroe», ci ha tenuto a dire. È vero, è un uomo che ha fatto la cosa giusta.   6 dicembre 2024 2024 © RIPRODUZIONE RISERVATA",https://www.corriere.it/opinioni/24_dicembre_06/il-coraggio-di-un-uomo-e-l-eredita-di-giulia-5b7c4c1e-db68-4660-bd1a-1672f48b6xlk.shtml
18,cds,cecchettin,dic2024,dic2024,Cristina Seymandi e l'archiviazione della denuncia contro gli attacchi on line: «Io offesa due volte. È un 'liberi tutti' agli hater»,"Parla di «profondo senso di disagio» e di «parole che offendono», come quelle che per giorni hanno intasato i suoi profili social. Cristina Seymandi, 48 anni, imprenditrice, apprende con «amarezza» che la Procura di Torino ha chiesto l’archiviazione della denuncia che, nell’estate 2023, aveva depositato contro centinaia di messaggi denigranti e sessisti che i leoni da tastiera le avevano riservato dopo che on line era rimbalzato il video nel quale l’ex fidanzato Massimo Segre annullava le nozze accusandola di tradimento. Si aspettava questo epilogo?«No, assolutamente. Ma soprattutto non mi aspettavo queste motivazioni. Subito sono rimasta senza parole, poi ho riflettuto su quanto scritto dal magistrato. In pratica, è un liberi tutti. Ciò che è vietato dire verbalmente nel mondo reale viene sdoganato sul web, che diventa uno schermo di protezione per gli hater».  Si ritiene offesa?«Due volte. Denunciare è stato un atto dovuto, non potevo far finta di nulla di fronte a messaggi intrisi di violenza e volgarità. Penso a tutte le persone che lo scorso 25 novembre sono scese in piazza per manifestare contro la violenza sulle donne, penso a come possano leggere e interpretare un’archiviazione di questo tenore in cui si dice che è “normale” sul web usare toni “robusti”. No, non è normale se quei toni ledono i diritti dei cittadini. La violenza contro le donne ha mille forme, tutte vanno combattute. Faccio mie le parole della sorella di Giulia Cecchettin,“sei vittima solo se sei morta”». Ha già valutato con il suo avvocato se fare opposizione?«Sì, è una questione di rispetto e diritti. Da anni si parla di cyberbullismo, si insegna ai ragazzi a non odiare, a usare in modo consapevole i social spiegando che le parole possono ferire. Poi questi ragazzi tornano a casa e apprendono dai giornali che è censurabile offendere altre persone, ma tutto sommato basta creare un profilo fake. Così la polizia postale — come nel mio caso — non riesce a rintracciarti. Insomma, mi pare tutto surreale». Quali erano le sue aspettative quando ho presentato denuncia?«Certamente non un risarcimento economico. Ritengo giusto che questi hater vengano identificati e puniti. Non so, magari vietando l’uso di Internet per qualche anno. Per ora, gli è stata data una pacca sulla spalla». Lei che riflessione ha fatto?«Si susseguono campagne di sensibilizzazione in cui si invitano le donne a denunciare violenze verbali e psicologiche, oltre a quelle fisiche. Ma ordinanze come questa creano sfiducia. Ecco, non bisogna farsi scoraggiare, perché l’emancipazione sociale è passata e passerà ancora attraverso le battaglie che le donne sono capaci di portare avanti. Se accettiamo certi postulati, come quelli enunciati nell’archiviazione, torniamo ai tempi della clava». La sua è una battaglia contro il sessismo?«No, è una battaglia di diritti. Le donne, e non solo, hanno il diritto di non essere verbalmente aggredite, umiliate e offese. Un diritto che vale nella vita reale e che deve essere esteso al mondo virtuale dei social. Non può esistere una zona franca, dove vige l’impunità. Insisto, gli insulti che ho ricevuto in quei giorni mi hanno mortificata, ma non piegata. Sono una donna forte e indipendente, ho gli strumenti per affrontare situazioni di questo genere. Ma ci sono donne, ragazze e ragazzi fragili che rischiano ogni giorno di finire nel mirino degli hater. Vanno tutelati». Sui social lei non ha incontrato solo hater, però?«All’inizio erano solo commenti negativi. Poi quando la mia vicenda è stata trattata in maniera completa dai quotidiani, in molti mi hanno mostrato solidarietà. Alcune persone mi hanno contattato per chiedermi un consiglio, persone che stavano vivendo difficoltà analoghe alla mia e volevano sapere come reagire. Sono stati scambi molto profondi che poi ho trasformato in un libro, “Ribelle”, che uscirà a fine gennaio» Vai a tutte le notizie di Torino Iscriviti alla newsletter di Corriere Torino 6 dicembre 2024 2024 © RIPRODUZIONE RISERVATA",https://torino.corriere.it/notizie/cronaca/24_dicembre_06/cristina-seymandi-intervista-archiviazione-hater-12c39851-1660-41ef-adc6-32cb68ce5xlk.shtml
19,cds,cecchettin,dic2024,dic2024,Alen e quel gesto in nome di Giulia Cecchettin: un «rumore» che fa bene per una nuova coscienza maschile,"Dice che l’avrebbe fatto comunque, anche se da difendere ci fosse stato un uomo, un «maschio» anziché una donna. Invece c’era proprio lei, a terra, una donna aggredita dal «suo» ex uomo (uomo?), che la stava accoltellando con la furia cieca dei maschi che non vedono un centimetro oltre la loro ignoranza sentimentale e il «no» al rifiuto non l’hanno mai imparato.  Stava per essere uccisa. Sarebbe stata uccisa. L’ha salvata Alen, origini bosniache, ventuno anni, al lavoro con un furgone-frigo nelle terre padane, nel Reggiano. Ha messo la sua vita in gioco e ha parlato con i fatti. E ha detto che nel farlo, mentre auto e passanti ignoravano quanto stava accadendo, ha pensato a Giulia e a tutte le (troppe) Giulie uccise.Un eroe? «No, io non sono un eroe», ha detto Alen. Ha ragione, ma scendendo un po’ di scala Alen è perlomeno un esempio di coraggioso civismo ed è protagonista di un atto perfino «politico» che sembra allargare lo spartiacque fra il «prima di Giulia» e il «dopo Giulia».  Certo, un solo femminicidio in più fa peggiore e  tragico il mondo ma paradossalmente potrebbe aver iniziato a salvarlo, in quella forma di «sacrificio» orribile e involontario che ha rappresentato la morte di una ragazza che sta continuando a vivere ogni giorno in noi e nelle nostre parole, nei  pensieri che tengono insieme i padri, le sorelle e i fratelli delle vittime e perfino, paradossalmente, quelli dei parenti dei carnefici che devono fare i conti con la «normalità» dell’orrore con cui stanno vivendo e  vivranno. Nessuna santificazione, quindi, ma ci piace pensare che quel ragazzo con il furgone-frigo sia anche il prodotto del «rumore» partito dai funerali, dalle piazze, dalle università, dalle scuole. Non silenzio: rumore per tutte le Giulie e perché non ce ne siano più. Rumore non è un fastidio ma una bella parola al di là ogni retorica. E denunciare, testimoniare, contaminare, far sentire, svegliare, sollecitare coscienze e pensiero. Un «bel fastidio» da condividere. Donne e uomini, ragazze e ragazzi. In una battaglia politica, etica e lessicale comune. Gli uomini, a differenza delle donne, non fanno «comunità», se non al bar e al calcetto (copyright lo psicologo Brian Vanzo, intervistato nei giorni scorsi su questo giornale). Le donne sono più «politiche», sono sorellanza che va oltre la fratellanza, sono comunità di pensiero e di linguaggio anche al di là dei sorrisetti che qualcuno sta per fare leggendo questo articolo. Sono più politiche e «contemporanee» perché hanno le ragioni e la presa di campo (sia rivendicativo che sistemico) di chi con fatica ha conquistato e sta conquistando diritti in un mondo in cui i diritti li hanno sempre stabiliti e distribuiti gli uomini, il «potere maschile». Da sempre, chi non ha diritti  è protagonista del cambiamento. Vale per quelli conquistati dalle classi operaie e dai sindacati in oltre duecento anni di  rivoluzione industriale; vale per la rivoluzione sessuale degli Anni Sessanta di cui le donne sono state il soggetto primario, vale ancor prima per il diritto di voto che le donne hanno ottenuto solo nel 1946 in questo Paese (in tanti ancora non lo sanno, a cominciare dai giovani: lo insegnino i professori nelle scuole...) e vale per il coraggioso protagonismo che in tutto il mondo integralista  e non libero le donne mettono in campo rischiando ogni giorno il carcere e spesso la vita. Esiste, d’altra parte,  una sensibilità maschile  di cui si parla poco e che sebbene atomizzata e tantomeno condivisa si è diffusa e si sta  diffondendo nelle famiglie, nel lavoro, nello sport, nei rapporti personali.  Una cultura al di fuori degli stereotipi, degli stigmi, dei luoghi comuni. Una forma di «educazione sentimentale  maschile»  capace di produrre la cultura del rispetto e della parità e dello stesso linguaggio che viene perfino prima del «politicamente corretto» sul quale spesso si litiga ma si deve comunque ragionare. Qualcuno, urlandolo, in un celebre film,  sosteneva che «le parole sono importanti» («Chi parla male, pensa male e vive male, bisogna trovare le parole giuste: le parole sono importanti». Nanni Moretti, Palombella rossa, 1989). Usiamole in armonia con il nostro pensiero e soprattutto con i fatti. Vai a tutte le notizie di Verona Iscriviti alla newsletter del Corriere del Veneto 5 dicembre 2024 2024 © RIPRODUZIONE RISERVATA",https://corrieredelveneto.corriere.it/notizie/verona/cronaca/24_dicembre_05/alen-e-quel-gesto-in-nome-di-giulia-cecchettin-un-rumore-che-fa-bene-per-una-nuova-coscienza-maschile-7b0f3c7b-d9ce-461a-a10e-8494910e2xlk.shtml
